{
  "$schema": "../schema/graflume.current-limitations.schema.json",
  "schemaVersion": 2,
  "release": "current-limitations-2026-08-26",
  "verifiedAt": "2026-08-26",
  "totalCompleted": 161,
  "families": [
    {
      "id": "annotation",
      "capabilities": [
        "data-coordinate primitive registry",
        "keyboard authoring",
        "drag and resize handles",
        "undo and redo"
      ],
      "traces": [
        {
          "capability": "data-coordinate primitive registry",
          "sources": [
            {
              "path": "src/annotation/primitives.ts",
              "token": "annotationPrimitiveRegistry"
            }
          ],
          "tests": [
            {
              "path": "tests/annotation-authoring.test.mjs",
              "name": "annotation primitive registry is closed and target-aware"
            }
          ]
        },
        {
          "capability": "keyboard authoring",
          "sources": [
            {
              "path": "src/interaction/annotation-authoring.ts",
              "token": "editAnnotationByKeyboard"
            }
          ],
          "tests": [
            {
              "path": "tests/annotation-authoring.test.mjs",
              "name": "keyboard authoring and bounded undo/redo preserve portable state"
            }
          ]
        },
        {
          "capability": "drag and resize handles",
          "sources": [
            {
              "path": "src/interaction/annotation-authoring.ts",
              "token": "editAnnotationByPointer"
            }
          ],
          "tests": [
            {
              "path": "tests/annotation-authoring.test.mjs",
              "name": "pointer handles move and resize portable annotation state"
            }
          ]
        },
        {
          "capability": "undo and redo",
          "sources": [
            {
              "path": "src/interaction/annotation-authoring.ts",
              "token": "AnnotationAuthoringHistory"
            }
          ],
          "tests": [
            {
              "path": "tests/annotation-authoring.test.mjs",
              "name": "keyboard authoring and bounded undo/redo preserve portable state"
            }
          ]
        }
      ]
    },
    {
      "id": "area",
      "capabilities": [
        "named and branched transform DAG reuse",
        "worker-bounded incremental stack updates",
        "automatic series labels",
        "data-domain navigation"
      ],
      "traces": [
        {
          "capability": "named and branched transform DAG reuse",
          "sources": [
            {
              "path": "src/data/dataflow.ts",
              "token": "TransformDataflow"
            }
          ],
          "tests": [
            {
              "path": "tests/foundation-dataflow-encoding.test.mjs",
              "name": "named transform sources and branches reuse one memoized DAG ancestor"
            }
          ]
        },
        {
          "capability": "worker-bounded incremental stack updates",
          "sources": [
            {
              "path": "src/data/worker-runtime.ts",
              "token": "WorkerIncrementalStackOperation"
            }
          ],
          "tests": [
            {
              "path": "tests/foundation-runtime.test.mjs",
              "name": "Worker v2 runs portable affected-group stacks and bounded bar virtualization transitions"
            }
          ]
        },
        {
          "capability": "automatic series labels",
          "sources": [
            {
              "path": "src/compiler/mark-labels.ts",
              "token": "seriesAutomaticGeometry"
            }
          ],
          "tests": [
            {
              "path": "tests/mark-label-authoring.test.mjs",
              "name": "stacked Bar totals and segments and Area series endpoints use calculated semantics"
            }
          ]
        },
        {
          "capability": "data-domain navigation",
          "sources": [
            {
              "path": "src/interaction/domain-navigation.ts",
              "token": "zoomDomainAtPixel"
            }
          ],
          "tests": [
            {
              "path": "tests/chart-interaction-runtime.test.mjs",
              "name": "data-domain navigation supports wheel, pointer drag, keyboard reset, and coordinate round-trip"
            }
          ]
        }
      ]
    },
    {
      "id": "bar",
      "capabilities": [
        "weighted count",
        "interactive sort and rank",
        "automatic total and segment labels",
        "worker-bounded virtualization"
      ],
      "traces": [
        {
          "capability": "weighted count",
          "sources": [
            {
              "path": "src/data/family-analytics.ts",
              "token": "weightedCount"
            }
          ],
          "tests": [
            {
              "path": "tests/statistical-advanced.test.mjs",
              "name": "bar compiler aggregates weighted counts and exposes deterministic rank changes"
            }
          ]
        },
        {
          "capability": "interactive sort and rank",
          "sources": [
            {
              "path": "src/data/family-layouts.ts",
              "token": "rankBars"
            }
          ],
          "tests": [
            {
              "path": "tests/family-layouts.test.mjs",
              "name": "bar ranking supports weighted count, stable sorting and rank-change metadata"
            }
          ]
        },
        {
          "capability": "automatic total and segment labels",
          "sources": [
            {
              "path": "src/compiler/mark-labels.ts",
              "token": "compileMarkLabels"
            }
          ],
          "tests": [
            {
              "path": "tests/mark-label-authoring.test.mjs",
              "name": "stacked Bar totals and segments and Area series endpoints use calculated semantics"
            }
          ]
        },
        {
          "capability": "worker-bounded virtualization",
          "sources": [
            {
              "path": "src/data/worker-runtime.ts",
              "token": "WorkerBarVirtualizationOperation"
            }
          ],
          "tests": [
            {
              "path": "tests/foundation-runtime.test.mjs",
              "name": "Worker v2 runs portable affected-group stacks and bounded bar virtualization transitions"
            }
          ]
        }
      ]
    },
    {
      "id": "bubble",
      "capabilities": [
        "absolute-area scale contract",
        "zero and negative policy",
        "explicit size guide"
      ],
      "traces": [
        {
          "capability": "absolute-area scale contract",
          "sources": [
            {
              "path": "src/data/family-analytics.ts",
              "token": "areaRadius"
            }
          ],
          "tests": [
            {
              "path": "tests/family-analytics.test.mjs",
              "name": "weighted count and absolute-area bubble sizing expose explicit policies and guide values"
            }
          ]
        },
        {
          "capability": "zero and negative policy",
          "sources": [
            {
              "path": "src/data/family-analytics.ts",
              "token": "BubbleNegativePolicy"
            }
          ],
          "tests": [
            {
              "path": "tests/statistical-advanced.test.mjs",
              "name": "bubble compiler uses proportional area, explicit negative/zero policies, and a truthful size guide"
            }
          ]
        },
        {
          "capability": "explicit size guide",
          "sources": [
            {
              "path": "src/data/family-analytics.ts",
              "token": "areaSizeGuide"
            }
          ],
          "tests": [
            {
              "path": "tests/family-analytics.test.mjs",
              "name": "weighted count and absolute-area bubble sizing expose explicit policies and guide values"
            }
          ]
        }
      ]
    },
    {
      "id": "calendar",
      "capabilities": [
        "year/month/week/day modes",
        "locale week start and timezone",
        "leap/no-data/zero policy",
        "month boundaries"
      ],
      "traces": [
        {
          "capability": "year/month/week/day modes",
          "sources": [
            {
              "path": "src/data/family-analytics.ts",
              "token": "CalendarMode"
            }
          ],
          "tests": [
            {
              "path": "tests/statistical-advanced.test.mjs",
              "name": "calendar compiler renders every range mode with week-start, timezone, leap, zero, missing, and month-boundary metadata"
            }
          ]
        },
        {
          "capability": "locale week start and timezone",
          "sources": [
            {
              "path": "src/data/family-analytics.ts",
              "token": "calendarWeekStart"
            }
          ],
          "tests": [
            {
              "path": "tests/statistical-advanced.test.mjs",
              "name": "calendar compiler renders locale and timezone semantics into weekday headers and civil-date cells"
            }
          ]
        },
        {
          "capability": "leap/no-data/zero policy",
          "sources": [
            {
              "path": "src/data/family-analytics.ts",
              "token": "CalendarMissingPolicy"
            }
          ],
          "tests": [
            {
              "path": "tests/family-analytics.test.mjs",
              "name": "calendar cells support mode, week start, time zone, leap, missing, zero, and month boundaries"
            }
          ]
        },
        {
          "capability": "month boundaries",
          "sources": [
            {
              "path": "src/data/family-analytics.ts",
              "token": "monthBoundary"
            }